<?xml version="1.0" encoding="UTF-8"?>
<!ELEMENT QLLOP (Lop)+ >
<!ELEMENT Lop (MaLop, TenLop) >
<!ELEMENT MaLop (#PCDATA) >
<!ELEMENT TenLop (#PCDATA) >